[
  {
    "id": "aop-wiki-sparql-endpoint",
    "name": "AOP-Wiki SPARQL endpoint",
    "namespace": "",
    "description": "Adverse outcome pathways: molecular initiating events, key events, chemical stressors, KERs",
    "group": "",
    "keywords": [
      "biolink:Pathway",
      "biolink:SmallMolecule"
    ],
    "taxonomic_scope": [
      "NCBITaxon:1"
    ],
    "endpoint_available": true,
    "endpoint_url": "https://aopwiki.rdf.bigcat-bioinformatics.org/sparql",
    "dump_available": false,
    "dump_url": "",
    "size": "unknown",
    "sparql_version": "unknown",
    "supports_federation": false,
    "example_query": "",
    "contact": "",
    "license": "unspecified",
    "citation_doi": "",
    "date_submitted": "2026-08-04",
    "date_last_update": "2026-08-04",
    "charted": true,
    "map_rdf": "https://kghub-261474.pages-forge.inrae.fr/aop_wiki/quotient.ttl",
    "map_view": "https://kghub-261474.pages-forge.inrae.fr/aop_wiki/quotient.html",
    "availability": "unknown"
  },
  {
    "id": "biogateway",
    "name": "BioGateway",
    "namespace": "",
    "description": "UniProt, GO, and other life science RDF sources: unified triplestore",
    "group": "",
    "keywords": [
      "biolink:SmallMolecule"
    ],
    "taxonomic_scope": [
      "NCBITaxon:1"
    ],
    "endpoint_available": true,
    "endpoint_url": "https://2407.biogateway.eu/sparql/",
    "dump_available": true,
    "dump_url": "https://zenodo.org/records/20747001",
    "size": "unknown",
    "sparql_version": "unknown",
    "supports_federation": false,
    "example_query": "",
    "contact": "",
    "license": "unspecified",
    "citation_doi": "",
    "date_submitted": "2026-08-04",
    "date_last_update": "2026-08-04",
    "charted": false,
    "map_rdf": "",
    "map_view": "",
    "availability": "unknown"
  },
  {
    "id": "brenda",
    "name": "BRENDA",
    "namespace": "",
    "description": "Enzyme function, kinetics, inhibitors, substrates, occurrence across organisms",
    "group": "",
    "keywords": [
      "biolink:MolecularActivity"
    ],
    "taxonomic_scope": [
      "NCBITaxon:1"
    ],
    "endpoint_available": true,
    "endpoint_url": "https://sparql.dsmz.de/api/brenda",
    "dump_available": true,
    "dump_url": "https://rdfportal.org/pub/ntriples/brenda/latest/",
    "size": "unknown",
    "sparql_version": "unknown",
    "supports_federation": false,
    "example_query": "",
    "contact": "",
    "license": "unspecified",
    "citation_doi": "",
    "date_submitted": "2026-08-04",
    "date_last_update": "2026-08-04",
    "charted": false,
    "map_rdf": "",
    "map_view": "",
    "availability": "unknown"
  },
  {
    "id": "chebi",
    "name": "ChEBI",
    "namespace": "",
    "description": "Small biologically relevant chemical compounds: curated structures, ontology, roles",
    "group": "",
    "keywords": [
      "biolink:SmallMolecule"
    ],
    "taxonomic_scope": [
      "NCBITaxon:1"
    ],
    "endpoint_available": true,
    "endpoint_url": "https://idsm.elixir-czech.cz/sparql/endpoint/chebi",
    "dump_available": true,
    "dump_url": "https://www.ebi.ac.uk/chebi/downloads",
    "size": "unknown",
    "sparql_version": "unknown",
    "supports_federation": false,
    "example_query": "",
    "contact": "",
    "license": "unspecified",
    "citation_doi": "",
    "date_submitted": "2026-08-04",
    "date_last_update": "2026-08-04",
    "charted": true,
    "map_rdf": "",
    "map_view": "",
    "availability": "unknown"
  },
  {
    "id": "chembl",
    "name": "chembl",
    "namespace": "",
    "description": "ChEMBL bioactive molecules, targets, and bioassays: Maastricht mirror",
    "group": "",
    "keywords": [
      "biolink:SmallMolecule"
    ],
    "taxonomic_scope": [
      "NCBITaxon:1"
    ],
    "endpoint_available": true,
    "endpoint_url": "https://chemblmirror.rdf.bigcat-bioinformatics.org/sparql",
    "dump_available": true,
    "dump_url": "https://ftp.ebi.ac.uk/pub/databases/chembl/ChEMBL-RDF/latest/",
    "size": "unknown",
    "sparql_version": "unknown",
    "supports_federation": false,
    "example_query": "",
    "contact": "",
    "license": "unspecified",
    "citation_doi": "",
    "date_submitted": "2026-08-04",
    "date_last_update": "2026-08-04",
    "charted": true,
    "map_rdf": "",
    "map_view": "",
    "availability": "unknown"
  },
  {
    "id": "enpkg",
    "name": "ENPKG",
    "namespace": "",
    "description": "Natural Product",
    "group": "",
    "keywords": [
      "biolink:SmallMolecule"
    ],
    "taxonomic_scope": [
      "NCBITaxon:1"
    ],
    "endpoint_available": true,
    "endpoint_url": "https://enpkg.commons-lab.org/graphdb/sparql",
    "dump_available": true,
    "dump_url": "https://enpkg.commons-lab.org/",
    "size": "unknown",
    "sparql_version": "unknown",
    "supports_federation": false,
    "example_query": "",
    "contact": "",
    "license": "unspecified",
    "citation_doi": "",
    "date_submitted": "2026-08-04",
    "date_last_update": "2026-08-04",
    "charted": true,
    "map_rdf": "",
    "map_view": "",
    "availability": "unknown"
  },
  {
    "id": "forum-knowledge-graph-database",
    "name": "FORUM Knowledge graph Database",
    "namespace": "",
    "description": "Chemicals linked to diseases, pathways, and PubMed MeSH annotations: metabolomics focus",
    "group": "",
    "keywords": [
      "biolink:Pathway",
      "biolink:Disease",
      "biolink:SmallMolecule",
      "biolink:Publication"
    ],
    "taxonomic_scope": [
      "NCBITaxon:1"
    ],
    "endpoint_available": true,
    "endpoint_url": "https://forum.semantic-metabolomics.fr/sparql/",
    "dump_available": true,
    "dump_url": "https://github.com/eMetaboHUB/Forum-DiseasesChem",
    "size": "unknown",
    "sparql_version": "unknown",
    "supports_federation": false,
    "example_query": "",
    "contact": "",
    "license": "unspecified",
    "citation_doi": "",
    "date_submitted": "2026-08-04",
    "date_last_update": "2026-08-04",
    "charted": true,
    "map_rdf": "",
    "map_view": "",
    "availability": "unknown"
  },
  {
    "id": "idsm-chemwebrdf",
    "name": "IDSM ChemWebRDF",
    "namespace": "",
    "description": "PubChem, ChEMBL, ChEBI small molecules: unified with substructure/similarity search",
    "group": "",
    "keywords": [
      "biolink:SmallMolecule"
    ],
    "taxonomic_scope": [
      "NCBITaxon:1"
    ],
    "endpoint_available": true,
    "endpoint_url": "https://idsm.elixir-czech.cz/sparql/endpoint/idsm",
    "dump_available": false,
    "dump_url": "",
    "size": "unknown",
    "sparql_version": "unknown",
    "supports_federation": false,
    "example_query": "",
    "contact": "",
    "license": "unspecified",
    "citation_doi": "",
    "date_submitted": "2026-08-04",
    "date_last_update": "2026-08-04",
    "charted": false,
    "map_rdf": "",
    "map_view": "",
    "availability": "unknown"
  },
  {
    "id": "linkdb",
    "name": "LinkDB",
    "namespace": "",
    "description": "Cross-references between all KEGG entries and external databases\n\nDump notes: Pas de dump, graph trop gros, l'extraction depuis le endpoint pose probl\u00e8me",
    "group": "",
    "keywords": [
      "biolink:SmallMolecule"
    ],
    "taxonomic_scope": [
      "NCBITaxon:1"
    ],
    "endpoint_available": true,
    "endpoint_url": "http://www.genome.jp/sparql/linkdb",
    "dump_available": false,
    "dump_url": "",
    "size": "XL",
    "sparql_version": "unknown",
    "supports_federation": false,
    "example_query": "",
    "contact": "",
    "license": "unspecified",
    "citation_doi": "",
    "date_submitted": "2026-08-04",
    "date_last_update": "2026-08-04",
    "charted": false,
    "map_rdf": "",
    "map_view": "",
    "availability": "unknown"
  },
  {
    "id": "lipid-maps",
    "name": "LIPID MAPS\u00ae",
    "namespace": "",
    "description": "Lipid structures, classification, and metabolism: lipidomics standard reference",
    "group": "",
    "keywords": [
      "biolink:SmallMolecule"
    ],
    "taxonomic_scope": [
      "NCBITaxon:1"
    ],
    "endpoint_available": true,
    "endpoint_url": "https://lipidmaps.org/sparql",
    "dump_available": false,
    "dump_url": "",
    "size": "unknown",
    "sparql_version": "unknown",
    "supports_federation": false,
    "example_query": "",
    "contact": "",
    "license": "unspecified",
    "citation_doi": "",
    "date_submitted": "2026-08-04",
    "date_last_update": "2026-08-04",
    "charted": true,
    "map_rdf": "",
    "map_view": "",
    "availability": "unknown"
  },
  {
    "id": "metanetx",
    "name": "MetaNetX",
    "namespace": "",
    "description": "Biochemical compounds and reactions reconciled across metabolic model namespaces",
    "group": "",
    "keywords": [
      "biolink:MolecularActivity",
      "biolink:SmallMolecule"
    ],
    "taxonomic_scope": [
      "NCBITaxon:1"
    ],
    "endpoint_available": true,
    "endpoint_url": "https://rdf.metanetx.org/sparql",
    "dump_available": true,
    "dump_url": "https://rdf.metanetx.org/",
    "size": "unknown",
    "sparql_version": "unknown",
    "supports_federation": false,
    "example_query": "",
    "contact": "",
    "license": "unspecified",
    "citation_doi": "",
    "date_submitted": "2026-08-04",
    "date_last_update": "2026-08-04",
    "charted": true,
    "map_rdf": "",
    "map_view": "",
    "availability": "unknown"
  },
  {
    "id": "plant-metabolic-pathways-wiki",
    "name": "Plant Metabolic Pathways Wiki",
    "namespace": "",
    "description": "Plant metabolic pathways: curated enzymes, reactions, and compounds",
    "group": "",
    "keywords": [
      "biolink:MolecularActivity",
      "biolink:Pathway",
      "biolink:SmallMolecule"
    ],
    "taxonomic_scope": [
      "NCBITaxon:1"
    ],
    "endpoint_available": true,
    "endpoint_url": "https://plantmetwiki.bioinformatics.nl/sparql",
    "dump_available": false,
    "dump_url": "",